{
  "allow_safe_auto_repair": true,
  "drift_policy": {
    "current_version_reference": "HARD_GATE_AFTER_REPAIR",
    "generated_manifest": "HARD_GATE_AFTER_REPAIR",
    "historical_version_reference": "ALLOW"
  },
  "hard_gate_lanes": [
    "repository-inspection",
    "development-hygiene",
    "software",
    "agent-entrypoint",
    "software-dry-run",
    "recovery-matrix",
    "frontend-smoke",
    "packaging-preflight",
    "firmware",
    "serial",
    "zero-tare",
    "calibration",
    "physical-loop"
  ],
  "profile": "integration",
  "version": "1.1.0"
}
